{
  "schema_version": "1.0.0",
  "session_id": "s1",
  "source": "fixture",
  "auth_method": "fixture",
  "payload_digest_sha256": "aaaaaaaaaaaaaaaaaaaaaaaaaaaaaaaaaaaaaaaaaaaaaaaaaaaaaaaaaaaaaaaa",
  "anti_replay_nonce": "nonce-12345678",
  "evidence_class": "software",
  "authenticated": true,
  "collected_at_utc": "2026-08-06T12:00:00Z",
  "notes": "valid fixture"
}
